{
  "title": "Persistent Mini Player Dock",
  "summary": "A polished persistent mini player dock that keeps playback controls visible while listeners browse deeper media screens.",
  "description": "A Spotify-inspired persistent mini player dock for media apps. The component keeps the active track, route status, progress, and transport controls pinned to the bottom while the main screen continues to show editorial browsing content. It includes a rich dark playback state and a lighter offline-downloaded variant so creators can reuse the same interaction pattern across music, podcasts, and saved audio flows.",
  "appName": "Spotify",
  "appStoreSearchHint": "Spotify music and podcasts",
  "rationale": "The mini player pattern is widely used in top media apps because it preserves playback context without interrupting browsing or discovery.",
  "codeFilePath": "/Users/test/web/copymyui/prisma/generated-seed/work/media__persistent-mini-player-dock/component.swift",
  "states": [
    {
      "name": "playing",
      "appearance": "dark",
      "description": "Active playback state with a rich gradient hero and persistent dock controls.",
      "rawScreenshotPath": "/Users/test/web/copymyui/public/generated-seed/media__persistent-mini-player-dock/raw/playing-dark.png"
    },
    {
      "name": "offline",
      "appearance": "light",
      "description": "Offline saved-audio state with lighter surfaces and downloaded playback messaging.",
      "rawScreenshotPath": "/Users/test/web/copymyui/public/generated-seed/media__persistent-mini-player-dock/raw/offline-light.png"
    }
  ],
  "selfReview": {
    "appealing": true,
    "visibleComponent": true,
    "notes": "Both screenshots clearly show the persistent mini player dock anchored over realistic browsing content in distinct visual states."
  }
}
